id,title,content
1,Siege of Veloria,"Roman legions surrounded the hill city for three months, eventually forcing surrender through starvation tactics."
2,The Iron Cohort,"An elite Roman unit earned its name after holding a mountain pass against repeated barbarian assaults."
3,Edict of Grain,"A provincial governor stabilized frontier unrest by reorganizing imperial grain shipments."
4,Battle of the Twin Rivers,"Two rival Roman commanders clashed over control of key bridge crossings in northern provinces."
5,Fortress of Sand,"A desert outpost became famous for resisting nomadic raids using layered defensive walls."
6,The Lost Eagle,"A legion's captured standard triggered a decade-long campaign to restore imperial honor."
7,March on Carthae,"Roman fleets supported a coordinated coastal advance to suppress rebellion."
8,Winter at Darnum,"Harsh weather forced Roman engineers to invent heated barracks for frontier troops."
9,The Senate Conspiracy,"Political intrigue nearly halted funding for a crucial military expedition."
10,Guardians of the Rhine,"Permanent watchtowers were built to monitor crossings and signal invasions."
11,The Broken Crown,"A medieval kingdom fractured when rival heirs refused a negotiated succession."
12,Siege of Alder Keep,"Trebuchets bombarded the castle walls until defenders negotiated safe passage."
13,Knights of the Silver Banner,"A chivalric order gained fame protecting merchant caravans across dangerous trade routes."
14,The Black Harvest,"Crop failures led feudal lords to wage small border wars over fertile valleys."
15,Treaty of Five Lords,"Regional nobles united temporarily to repel a northern invasion."
16,The Stone Road Campaign,"Armies fought to control a strategic trade road linking two capitals."
17,Battle of Red Field,"Heavy cavalry charges decided the outcome of a brief but decisive clash."
18,The Monastery Pact,"Religious leaders brokered a ceasefire between warring dukes."
19,Fortress of Thornwatch,"Archers stationed on forest towers defended the realm from raiders."
20,The Crown Rebellion,"Peasant uprisings forced the monarchy to reduce wartime taxes."
21,Winter Siege of Marrowgate,"Frozen rivers allowed attackers to approach city walls unexpectedly."
22,The Mercenary Charter,"Foreign soldiers were granted land in exchange for long-term service."
23,The Silent Armada,"A medieval fleet launched a surprise night landing along the enemy coast."
24,War of Three Banners,"Competing claimants used propaganda to win support from rural provinces."
25,The Bell Tower Defense,"Town militias held a central tower that controlled access to surrounding bridges."
26,Operation Iron Bridge,"WW2 engineers rebuilt a destroyed crossing under constant artillery fire."
27,The Coastal Radar Line,"Early warning stations helped intercept incoming air raids."
28,Battle of North Ridge,"Infantry divisions fought for control of high ground overlooking supply routes."
29,Convoy HX-117,"Escort destroyers defended merchant ships against submarine attacks."
30,The Factory Evacuation,"Industrial machinery was relocated inland to avoid bombing campaigns."
31,Codebreakers of Station Alder,"Signals intelligence teams shortened the war by deciphering enemy communications."
32,Operation Snowfall,"Winter offensives relied on camouflage uniforms and mobile artillery."
33,The Desert Airlift,"Transport aircraft supplied isolated units trapped behind advancing enemy lines."
34,Battle of Harbor Seven,"Naval patrol boats prevented sabotage of critical shipping facilities."
35,The Resistance Network,"Local partisans coordinated sabotage operations against occupying forces."
36,The Armored Breakthrough,"Tank formations breached fortified defenses using concentrated assaults."
37,Defense of Hill 402,"Entrenched infantry repelled repeated mechanized attacks."
38,The Night Bomber Wing,"Low-altitude missions disrupted enemy rail movements."
39,Operation Lantern,"Special forces secured lighthouse positions to guide invasion fleets."
40,The Supply Corridor,"Maintaining a narrow logistics route proved decisive in sustaining frontline troops."
41,Fortress Europa Line,"Extensive coastal fortifications attempted to deter amphibious invasions."
42,The Eastern Counteroffensive,"Mass mobilization pushed back enemy forces after months of retreat."
43,Bridge at Kessel Town,"Paratroopers captured a key crossing hours before armored reinforcements arrived."
44,The War Production Board,"Centralized planning dramatically increased equipment output."
45,Battle of the Fog Coast,"Poor visibility caused chaotic naval engagements with heavy losses."
46,Operation Iron Shield,"Anti-aircraft networks protected industrial regions from sustained bombing."
47,The Mountain Partisans,"Irregular fighters controlled alpine passes and harassed supply convoys."
48,The Final Push,"Coordinated allied offensives overwhelmed defensive strongholds."
49,Reconstruction Mandate,"Postwar authorities prioritized rebuilding railways and ports."
50,Legacy of the Armistice,"Peace agreements reshaped borders and military alliances for decades."
51,Legion of the Eastern Sun,"A Roman auxiliary force recruited from eastern provinces became renowned for desert warfare tactics."
52,The Marble Fort,"Engineers constructed a fortified command center using reinforced stone to withstand prolonged sieges."
53,Battle of Lorian Plains,"Roman cavalry outmaneuvered tribal warriors in a decisive open-field engagement."
54,Tax Revolt of Corvinus,"Provincial citizens rebelled after harsh levies were imposed to fund distant campaigns."
55,The Frontier Canal,"Military laborers dug irrigation channels that doubled as defensive barriers."
56,Shieldwall at Bracca,"Roman infantry formed an unbroken defensive line to repel successive charges."
57,The Governor's Ultimatum,"A diplomatic threat forced neighboring tribes into a temporary alliance with Rome."
58,Siege of Portus Alba,"Naval blockades cut off the harbor city's food supply until surrender."
59,The Veteran Colonies,"Retired soldiers were settled along borders to reinforce imperial presence."
60,March of the Sixth Legion,"A rapid forced march allowed reinforcements to arrive before enemy forces expected."
61,The Iron King’s Decree,"A medieval monarch centralized control by demanding direct oaths from lesser nobles."
62,Siege of Frostholm,"Attackers tunneled beneath frozen walls to collapse key defensive towers."
63,The Golden Caravan Route,"Merchant guilds funded private guards to protect lucrative desert trade."
64,Battle of the Shattered Bridge,"Defenders destroyed the crossing mid-battle to halt an invading army."
65,The Abbey Treasury War,"Rival barons fought to control a monastery rumored to store vast wealth."
66,Order of the White Lance,"Mounted knights specialized in rapid-response defense of frontier villages."
67,The Harvest Truce,"Seasonal ceasefires allowed peasants to gather crops despite ongoing wars."
68,Fortress Highcliff,"Built atop sheer rock faces, the stronghold remained unconquered for generations."
69,The River Toll Conflict,"Trade disputes escalated into open warfare between neighboring duchies."
70,Siege Engines of Valen,"Innovative counterweight trebuchets extended bombardment range dramatically."
71,The Silver Coin Reform,"Currency standardization strengthened royal authority across feudal lands."
72,Battle of Pine Hollow,"Ambushing archers defeated a numerically superior invading force."
73,The Knightly Census,"Feudal rulers recorded military obligations to improve mobilization planning."
74,War of the Border Marches,"Small-scale skirmishes persisted for decades along disputed territories."
75,The Crown’s Hostage Pact,"Royal heirs were exchanged to guarantee temporary peace between rival kingdoms."
76,Operation Steel Harbor,"WW2 naval engineers fortified docks to maintain continuous supply landings."
77,The Arctic Convoys,"Allied shipping routes through icy waters delivered essential equipment despite heavy losses."
78,Battle of Iron Valley,"Tank engagements across narrow terrain resulted in prolonged stalemates."
79,The Strategic Fuel Reserve,"Hidden depots ensured armored divisions could continue deep offensives."
80,Operation Silent Drop,"Nighttime airborne landings secured communication hubs behind enemy lines."
81,The Coastal Minefields,"Extensive underwater defenses deterred amphibious assaults."
82,Defense of Capital Sector,"Urban barricades slowed advancing forces until reinforcements arrived."
83,The Code Relay Stations,"Encrypted communication networks coordinated multinational operations."
84,The Island Hopper Campaign,"Sequential amphibious assaults captured key bases across the region."
85,Operation Rolling Thunderhead,"Sustained artillery bombardment softened entrenched defensive positions."
86,The Merchant Fleet Conversion,"Civilian ships were retrofitted to transport troops and armored vehicles."
87,Battle of the Rail Junction,"Control of intersecting rail lines determined regional supply dominance."
88,The Desert Recon Units,"Light vehicles conducted long-range scouting across hostile terrain."
89,Operation Harbor Sweep,"Minesweepers cleared naval channels ahead of invasion convoys."
90,The Emergency Ration Act,"Governments introduced standardized food supplies for both civilians and soldiers."
91,Defense Line Gamma,"Layered bunkers forced attackers into costly frontal assaults."
92,The Factory Night Shift,"Round-the-clock production dramatically increased aircraft output."
93,Battle of Western Skies,"Large-scale dogfights determined air superiority over contested regions."
94,Operation Iron Lantern,"Mobile searchlight units tracked incoming bombers during night raids."
95,The Mountain Supply Route,"Pack animals and narrow roads sustained remote defensive garrisons."
96,Resistance Broadcast Network,"Underground radio transmitters relayed intelligence to allied command."
97,Operation Northern Spear,"A rapid armored thrust encircled retreating enemy divisions."
98,The Coastal Evacuation,"Civilian populations were relocated ahead of advancing battlefronts."
99,The Engineers’ Breakthrough,"Combat engineers cleared fortified obstacles to open invasion corridors."
100,The Postwar Alliance Charter,"Nations established mutual defense agreements to prevent future global conflict."
101,Legion of the Northern Star,"Roman commanders stationed veteran troops along the frozen frontier to deter seasonal incursions."
102,The Harbor Tax Edict,"Increased port duties funded expansion of the imperial navy."
103,Battle of Crescent Hill,"Roman skirmishers secured high terrain before the main infantry engagement began."
104,The Bronze Shield Reform,"Standardized equipment production improved battlefield coordination."
105,Siege of Tarracon Minor,"Repeated assaults failed until engineers redirected a nearby river to weaken city walls."
106,The Merchant Protection Fleet,"War galleys escorted grain shipments through pirate-infested waters."
107,Frontier Beacon Network,"Signal fires relayed invasion warnings across hundreds of miles in a single night."
108,The Legionary Oath Renewal,"Annual ceremonies reinforced loyalty among newly recruited soldiers."
109,Fort Aurelian Gate,"A fortified checkpoint regulated movement along a strategic mountain pass."
110,The Desert Alliance Pact,"Roman envoys secured cooperation from nomadic tribes through trade incentives."
111,The War of Hollow Thrones,"Medieval claimants fought over an abandoned royal title with symbolic authority."
112,Siege of Blackmere,"Flooded marshlands turned the prolonged siege into a battle of endurance."
113,The Guild Militia Charter,"Urban craftsmen organized defensive companies funded by merchant councils."
114,Battle of Eastford Crossing,"Control of a narrow bridge decided the outcome within hours."
115,The Royal Road Expansion,"Stone highways enabled faster troop movements between distant provinces."
116,The Crimson Tournament,"A ceremonial joust unexpectedly sparked a political rivalry between noble houses."
117,Fortress Ironvale,"Massive gatehouses allowed defenders to withstand years of intermittent attacks."
118,The Salt Trade Conflict,"Control of coastal salt fields ignited a regional economic war."
119,The Winter Banner Campaign,"Armies delayed conflict until frozen ground allowed heavy cavalry maneuvers."
120,The Castle Steward Revolt,"Local administrators rebelled after prolonged taxation during wartime."
121,Order of the Lantern Knights,"A small knightly brotherhood specialized in defending remote monasteries."
122,The Treaty of Rivermeet,"Neutral envoys negotiated safe trading rights along contested waterways."
123,Battle of the Amber Coast,"Naval archers dominated sea lanes with long-range incendiary arrows."
124,The Crown Armory Decree,"Centralized weapon storage ensured rapid mobilization during emergencies."
125,The Pilgrim Road Defense,"Temporary forts protected travelers from roaming bandits."
126,Operation Thunder Convoy,"WW2 supply fleets delivered armored vehicles to newly opened fronts."
127,The Radar Calibration Mission,"Technicians improved early-warning accuracy by repositioning coastal arrays."
128,Battle of Granite Ridge,"Entrenched artillery positions held off repeated armored assaults."
129,The Emergency Shipyard Program,"Temporary docks accelerated construction of escort vessels."
130,Operation Night Signal,"Covert teams disrupted enemy communication towers before major offensives."
131,The Desert Fuel Pipeline,"A hidden supply line sustained long-range mechanized operations."
132,Defense of Harbor Delta,"Anti-ship batteries protected incoming reinforcement convoys."
133,The Allied Training Initiative,"Joint exercises standardized tactics across multinational forces."
134,Battle of the Eastern Rails,"Competing armies fought fiercely for control of locomotive repair yards."
135,Operation Skyguard,"Fighter patrol rotations reduced bombing damage to industrial regions."
136,The Snowfield Encirclement,"Armored divisions trapped opposing forces during a winter retreat."
137,The Emergency Bridge Corps,"Rapid-deployment engineers assembled portable crossings within hours."
138,Operation Coastal Hammer,"Combined naval bombardment and amphibious landings secured beachheads."
139,The Intelligence Courier Line,"Motorcycle units transported encrypted documents between commands."
140,Battle of Harbor Heights,"Urban combat raged for weeks over a strategic hillside district."
141,The Strategic Rubber Reserve,"Stockpiled materials ensured continued vehicle production despite shortages."
142,Operation Iron Coast,"Heavy fortifications slowed invasion attempts long enough for reinforcements."
143,The Mountain Airstrips,"Short runways allowed supply aircraft to reach isolated defensive units."
144,The Convoy Escort Doctrine,"Revised naval tactics significantly reduced merchant ship losses."
145,Operation Northern Beacon,"Recon patrols established observation posts deep behind enemy lines."
146,The Emergency Medical Corps,"Field hospitals introduced rapid evacuation procedures for wounded troops."
147,Battle of Silver Marsh,"Armies maneuvered cautiously through difficult wetlands for weeks."
148,Operation Rolling Advance,"Coordinated infantry and armor pushes reclaimed lost territories."
149,The Reconstruction Logistics Plan,"Allied planners prioritized restoring bridges and rail systems."
150,The Veterans Settlement Act,"Postwar policies granted land to returning soldiers to stabilize frontier regions."
151,Legion of the Sapphire Coast,"Roman marines secured vital coastal settlements to maintain uninterrupted trade routes."
152,The Fortified Granaries,"Border provinces constructed reinforced storage sites to prevent famine during sieges."
153,Battle of Vindex Pass,"A narrow mountain corridor became the site of a decisive defensive victory."
154,The Imperial Road Census,"Surveyors mapped military highways to improve logistical planning."
155,Siege of Lumen Port,"A prolonged naval blockade forced the harbor city to negotiate surrender."
156,The Auxiliary Cavalry Reform,"Foreign horsemen were reorganized into standardized Roman command structures."
157,The Watchtower Accord,"Frontier tribes agreed to maintain joint patrols against raiders."
158,The Iron Tribute Conflict,"Refusal to deliver annual metal taxes sparked a regional uprising."
159,Fortress of the Red Dunes,"A desert stronghold protected inland caravan routes from ambush."
160,The Veteran Guard Edict,"Experienced soldiers were reassigned to train newly formed frontier units."
161,War of the Two Duchies,"Medieval rivals contested inheritance rights to a fertile river basin."
162,Siege of Falconreach,"Defenders relied on elevated ballista towers to repel advancing armies."
163,The Merchant Navy Compact,"Coastal towns pooled resources to build a shared defensive fleet."
164,Battle of Thorn Valley,"Hidden infantry formations launched a surprise attack from dense woodland."
165,The Royal Mint Expansion,"Increased coin production financed extended military campaigns."
166,The Knight Marshal’s Reform,"A centralized command structure replaced scattered feudal levies."
167,Fortress Greyspire,"Tall stone towers allowed early detection of approaching siege forces."
168,The Timber War,"Competition over forest resources escalated into prolonged border conflicts."
169,The Abbey Grain Pact,"Religious institutions provided emergency supplies in exchange for tax exemptions."
170,The Banner Council,"Regional nobles formed a temporary alliance to counter foreign invasion."
171,Battle of Eastwatch Plains,"Heavy infantry formations clashed in one of the era’s largest field battles."
172,The Harbor Chain Defense,"Massive iron chains were stretched across ports to block enemy fleets."
173,The Crown Survey Initiative,"Land assessments improved the efficiency of feudal taxation."
174,The Winter March Accord,"Opposing armies paused campaigns during severe seasonal storms."
175,Order of the Golden Spur,"Elite cavalry units were tasked with protecting royal envoys."
176,Operation Iron Convoy,"WW2 merchant fleets transported vital raw materials across contested seas."
177,The Coastal Air Defense Grid,"Integrated radar and artillery systems reduced bombing effectiveness."
178,Battle of Ridgepoint Sector,"Entrenched defenders slowed a major mechanized offensive."
179,The Emergency Steel Program,"Industrial output surged through centralized wartime planning."
180,Operation Silent Harbor,"Special teams sabotaged enemy dock facilities before naval assaults."
181,The Arctic Recon Patrols,"Small scouting units gathered intelligence in extreme northern conditions."
182,Defense of Central Junction,"Railway hubs were heavily fortified to maintain supply continuity."
183,Operation Thunder Bridge,"Engineers rebuilt a destroyed crossing overnight under enemy fire."
184,The Allied Logistics Council,"Coordinated planning improved distribution of ammunition and fuel."
185,Battle of Crimson Shore,"Amphibious landings faced fierce resistance along fortified beaches."
186,The Mobile Repair Battalions,"Frontline workshops restored damaged tanks within hours."
187,Operation Night Beacon,"Coastal signal units guided friendly bombers through heavy fog."
188,The Desert Fortification Line,"A chain of bunkers secured key approaches to inland cities."
189,Battle of Northern Fields,"Large-scale armored clashes determined regional control."
190,The Convoy Air Escort Doctrine,"Long-range fighters began accompanying shipping routes."
191,Operation Granite Wall,"Massive defensive barriers slowed advancing enemy divisions."
192,The Intelligence Debrief Initiative,"Captured documents provided insight into enemy strategy."
193,Battle of Harbor Junction,"Urban combat erupted around a vital shipping terminal."
194,The Emergency Aviation Schools,"Accelerated training programs produced thousands of new pilots."
195,Operation Rolling Supply,"Continuous truck convoys maintained momentum of advancing forces."
196,The Mountain Defense Brigades,"Specialized troops protected narrow alpine transit routes."
197,Operation Steel Dawn,"A coordinated dawn offensive reclaimed several strategic towns."
198,The Reconstruction Finance Act,"Governments allocated resources to rebuild damaged infrastructure."
199,The Veterans Employment Corps,"Returning soldiers were integrated into national construction projects."
200,The Continental Security Charter,"Postwar treaties established cooperative defense arrangements across allied nations."
201,Legion of the Western March,"Roman commanders deployed seasoned troops to stabilize newly annexed frontier territories."
202,The Stone Aqueduct Defense,"Engineers fortified a major water supply route to prevent sabotage during wartime."
203,Battle of Aurelia Ford,"Control of a shallow river crossing determined the outcome of the campaign."
204,The Imperial Messenger Corps,"Relay riders ensured rapid communication between distant garrisons."
205,Siege of Castra Nova,"A fortified camp evolved into a permanent city after years of military occupation."
206,The Grain Fleet Escort,"Naval patrols protected food shipments destined for the capital."
207,The Bronze Standard Reform,"Uniform equipment manufacturing improved reliability across legions."
208,Fortress of High Sand,"Elevated ramparts allowed defenders to repel repeated desert assaults."
209,The Border Market Pact,"Trade agreements reduced tensions between Rome and neighboring tribes."
210,The Veteran Training Fields,"Retired centurions established academies to train new recruits."
211,War of the Crimson Duke,"A medieval noble launched expansion campaigns against neighboring baronies."
212,Siege of Riverhold,"Attackers diverted nearby streams to weaken defensive moats."
213,The Guild Coin Alliance,"Merchant organizations issued standardized trade currency across cities."
214,Battle of Long Meadow,"Infantry lines fought a prolonged engagement lasting several days."
215,The Royal Beacon Towers,"Signal fires coordinated troop movements across distant provinces."
216,Order of the Iron Mantle,"A knightly order specialized in defending royal caravans."
217,Fortress Dawnwatch,"A coastal stronghold monitored incoming fleets from distant horizons."
218,The Timber Levy Revolt,"Peasants rebelled against increased wood collection for siege engines."
219,The Crown Cavalry Muster,"Annual assemblies ensured mounted forces remained battle-ready."
220,The Abbey Sanctuary Treaty,"Religious lands were declared neutral zones during regional conflicts."
221,Battle of Stonebridge Crossing,"A narrow stone span became the focal point of a decisive clash."
222,The Harbor Customs Charter,"New regulations improved taxation efficiency on imported goods."
223,The Banner of Unity Campaign,"Multiple duchies combined forces to repel an external invasion."
224,The Iron Bell Warning System,"Cities installed large bells to signal sudden attacks."
225,The Winter Fortress Agreement,"Temporary truces allowed rebuilding of damaged fortifications."
226,Operation Coastal Shield,"WW2 defensive batteries protected major shipping ports."
227,The Allied Rail Restoration,"Engineers repaired damaged tracks to accelerate supply movement."
228,Battle of Hillfront Sector,"Entrenched artillery controlled the surrounding battlefield."
229,The Emergency Fuel Convoys,"Protected tanker shipments ensured continued mechanized operations."
230,Operation Silent Current,"Submarines conducted reconnaissance along enemy coastlines."
231,The Industrial Labor Mobilization,"Civilian workers were reassigned to essential wartime factories."
232,Defense of Delta Airfield,"Fighter squadrons protected a crucial logistics airport."
233,Operation Iron Landing,"Amphibious troops secured a contested shoreline under heavy fire."
234,The Radar Expansion Network,"New installations extended early-warning coverage across regions."
235,Battle of Crossroads City,"Urban street fighting determined control of transportation hubs."
236,The Mobile Field Kitchens,"Improved rations boosted morale among frontline units."
237,Operation Night Convoy,"Darkness provided cover for high-risk resupply missions."
238,The Strategic Aluminum Reserve,"Stockpiles ensured continued aircraft manufacturing."
239,Battle of East Harbor,"Naval artillery exchanges damaged both defending and attacking fleets."
240,The Engineer Assault Teams,"Specialized units cleared obstacles ahead of advancing infantry."
241,Operation Steel Corridor,"Armored columns secured a narrow route linking allied fronts."
242,The Communications Relay Trucks,"Mobile transmitters maintained coordination during fast offensives."
243,Battle of Northern Ridgeway,"Infantry divisions fought to secure elevated observation points."
244,The Emergency Hospital Ships,"Converted vessels treated wounded soldiers near combat zones."
245,Operation Granite Spear,"A concentrated breakthrough shattered entrenched defensive lines."
246,The Mountain Supply Convoys,"Tracked vehicles transported equipment through rugged terrain."
247,Operation Harbor Renewal,"Rapid repairs restored damaged docks to operational capacity."
248,The War Bonds Initiative,"Civilian investment campaigns funded large-scale military production."
249,The Veterans Housing Program,"Governments constructed new communities for returning troops."
250,The Global Security Accord,"Postwar diplomatic agreements established long-term international cooperation."
251,Legion of the Silver Frontier,"Roman patrol units guarded mineral-rich borderlands against organized raids."
252,The Harbor Grain Reserves,"Strategic storage facilities ensured the capital could endure prolonged blockades."
253,Battle of Ventus Hills,"Swift cavalry maneuvers secured the elevated terrain before enemy reinforcements arrived."
254,The Imperial Survey Decree,"Cartographers were commissioned to map newly conquered territories for military planning."
255,Siege of Port Helion,"Combined naval and land assaults forced the surrender of the fortified harbor."
