id,title,content
256,The Auxiliary Archer Cohorts,"Specialized ranged units from allied regions strengthened legion formations."
257,The Frontier Treaty of Lora,"Diplomatic negotiations temporarily stabilized relations with neighboring tribes."
258,Fortress of the Twin Gates,"A dual-entry stronghold controlled access to a vital inland trade route."
259,The Veteran Settlement Program,"Discharged soldiers received farmland in contested provinces to reinforce loyalty."
260,The River Fleet Expansion,"Additional patrol ships secured inland waterways from piracy."
261,War of the Sapphire Crown,"Medieval rivals contested succession after the sudden death of a monarch."
262,Siege of Northwall Keep,"Defenders relied on boiling oil and reinforced gates to repel attackers."
263,The Merchant League Defense Pact,"Trading cities formed alliances to protect shared commercial interests."
264,Battle of Golden Fields,"Heavy infantry engagements determined the fate of a fertile agricultural region."
265,The Royal Tax Reforms,"Streamlined collection systems improved funding for military campaigns."
266,Order of the Falcon Knights,"Elite cavalry units specialized in reconnaissance across open plains."
267,Fortress Brightwatch,"A lighthouse-fort combination guided friendly fleets while spotting enemy sails."
268,The Ironwood Conflict,"Competing kingdoms fought for control of dense forests used for shipbuilding."
269,The Abbey Chronicle Accord,"Monastic scribes documented territorial agreements to prevent disputes."
270,The Banner Muster of Elden,"Regional lords assembled their levies for a large-scale defensive campaign."
271,Battle of Highridge Pass,"Narrow mountain terrain favored defenders holding elevated positions."
272,The Crown Armory Expansion,"Centralized weapon workshops increased production of standardized arms."
273,The Coastal Beacon Network,"Signal fires warned coastal towns of approaching fleets."
274,The Harvest Peace Edict,"Temporary ceasefires were declared during planting and harvest seasons."
275,The River Toll Treaty,"Neighboring states negotiated shared taxation rights over major crossings."
276,Operation Steel Convoy,"WW2 transport fleets delivered armored vehicles to newly opened fronts."
277,The Strategic Airfield Initiative,"Rapid construction created forward bases for fighter squadrons."
278,Battle of Western Corridor,"Control of a narrow transportation route shaped the campaign outcome."
279,The Emergency Fuel Rationing Act,"Civilian restrictions preserved resources for military operations."
280,Operation Silent Shore,"Commando units destroyed coastal radar installations before invasion."
281,The Arctic Supply Flights,"Cargo aircraft delivered equipment to isolated northern units."
282,Defense of Central Harbor,"Heavy anti-aircraft guns protected the main naval logistics center."
283,Operation Iron Rail,"Military engineers rebuilt bombed railway lines to maintain supply chains."
284,The Allied Command Conference,"Strategic leaders coordinated joint multinational offensives."
285,Battle of Iron Plateau,"Armored divisions clashed across open terrain with heavy losses."
286,The Mobile Communications Corps,"Truck-mounted radio units ensured constant battlefield coordination."
287,Operation Dawn Landing,"Amphibious troops captured key shoreline defenses at first light."
288,The Industrial Output Directive,"Government planning boards set mandatory production quotas."
289,Battle of Eastgate City,"Street-by-street combat determined control of the regional capital."
290,The Convoy Escort Carrier Program,"Small aircraft carriers improved air protection for shipping lanes."
291,Operation Northern Hammer,"A rapid winter offensive forced enemy withdrawals across the front."
292,The Field Engineering Brigades,"Specialists constructed bridges and fortifications under combat conditions."
293,Battle of Silver Coast,"Naval bombardments supported ground troops advancing inland."
294,The Emergency Medical Evacuation Plan,"Air transport reduced mortality rates among wounded soldiers."
295,Operation Granite Advance,"Infantry and armor units pushed through fortified defensive belts."
296,The Mountain Radar Stations,"High-altitude installations expanded early-warning coverage."
297,Operation Harbor Lifeline,"Continuous resupply missions sustained besieged allied positions."
298,The Reconstruction Transport Act,"Rail and shipping systems were rapidly restored after liberation."
299,The Veterans Reintegration Program,"Governments provided employment training for returning servicemen."
300,The Continental Defense Union,"Postwar alliances formed cooperative military planning frameworks."
301,Legion of the Eastern Frontier,"Roman commanders established a rotating garrison system to maintain constant border readiness."
302,The Imperial Dockyards,"Expanded shipyards increased naval patrol capacity across the inner seas."
303,Battle of the Scarlet Ridge,"Legionary formations secured the elevated ground after a fierce dawn assault."
304,The Census of Arms,"An empire-wide inventory ensured all garrisons met equipment standards."
305,Siege of Valeria Port,"Blockading fleets cut off trade until the fortified city surrendered."
306,The Desert Signal Towers,"Watch posts relayed warnings of nomadic incursions across vast distances."
307,The Auxiliary Spear Reform,"Training programs standardized tactics among allied infantry units."
308,Fortress Argentum,"A mining settlement was fortified to protect vital silver production."
309,The Grain Convoy Act,"Strict escort regulations reduced losses of food shipments to raiders."
310,The Veteran Legion Reserve,"Retired soldiers formed a rapid-response defense force for emergencies."
311,War of the Broken Seal,"Medieval kingdoms disputed a revoked royal charter granting territorial rights."
312,Siege of Frostgate Castle,"Attackers relied on prolonged blockade rather than direct assault."
313,The Merchant Council Fleet,"Trade guilds funded patrol vessels to protect coastal commerce."
314,Battle of Green Hollow,"Ambush tactics allowed a smaller defending army to defeat invaders."
315,The Royal Road Patrols,"Mounted guards ensured the safety of long-distance travelers."
316,Order of the Crimson Cloak,"A secretive knightly order specialized in diplomatic escort missions."
317,Fortress Riverguard,"Massive stone walls protected the only crossing for miles."
318,The Salt Harbor Dispute,"Rival lords clashed over control of lucrative export docks."
319,The Crown Tax Standardization,"Unified taxation strengthened central authority over feudal regions."
320,The Banner Alliance of Northreach,"Several minor baronies united to resist expansion by a neighboring realm."
321,Battle of Ember Plains,"Cavalry charges determined the swift outcome of a decisive engagement."
322,The Abbey Safehaven Pact,"Monasteries offered refuge to civilians during wartime sieges."
323,The Timber Supply Accord,"Kingdoms negotiated shared access to vital shipbuilding forests."
324,The Knightly Muster Edict,"Annual inspections ensured feudal levies remained combat-ready."
325,The Winter Truce of Stonevale,"Opposing forces halted campaigns due to extreme seasonal conditions."
326,Operation Steel Harbor Convoy,"WW2 naval escorts defended supply ships entering contested ports."
327,The Allied Radar Upgrade,"Improved detection systems extended early-warning coverage."
328,Battle of Iron Junction,"Control of a railway interchange determined logistical superiority."
329,The Emergency Aircraft Expansion,"Accelerated factory programs increased fighter production."
330,Operation Silent Bridge,"Commandos secured intact river crossings ahead of advancing troops."
331,The Fuel Depot Camouflage Plan,"Hidden storage sites reduced vulnerability to bombing."
332,Defense of Coastal Sector Nine,"Layered artillery positions repelled repeated amphibious probes."
333,Operation Rolling Rail,"Rapid repairs restored damaged transportation lines within days."
334,The Joint Command Directive,"Unified leadership improved coordination between allied armies."
335,Battle of Granite Hills,"Entrenched defenders delayed an advancing armored corps for weeks."
336,The Mobile Anti-Air Units,"Truck-mounted guns provided flexible air defense coverage."
337,Operation Northern Convoy Shield,"Escort carriers protected shipping lanes through hostile waters."
338,The Industrial Night Production Act,"Factories operated continuously to meet wartime demands."
339,Battle of Harbor East,"Naval engagements erupted as fleets contested docking facilities."
340,The Engineer Rapid Build Teams,"Prefabricated materials allowed fast construction of defensive positions."
341,Operation Dawn Spearhead,"A concentrated armored push broke through defensive lines at sunrise."
342,The Field Communications Upgrade,"Portable radios improved coordination among frontline platoons."
343,Battle of the Marsh Corridor,"Difficult terrain slowed both advancing and retreating forces."
344,The Emergency Hospital Network,"Expanded field hospitals reduced transport times for wounded soldiers."
345,Operation Mountain Shield,"Specialized units fortified alpine passes against surprise attacks."
346,The Strategic Steel Allocation Board,"Central planning prioritized armor and artillery manufacturing."
347,Operation Harbor Recovery,"Repair crews restored bomb-damaged docks within weeks."
348,The Reconstruction Trade Initiative,"Postwar agreements reopened international shipping routes."
349,The Veterans Education Program,"Returning soldiers received state-funded technical training."
350,The Global Defense Framework,"Allied nations established coordinated planning for long-term security cooperation."
351,Legion of the Iron Coast,"Roman naval infantry secured vulnerable shorelines against sudden pirate incursions."
352,The Imperial Fortification Drive,"A large-scale construction program reinforced border defenses across multiple provinces."
353,Battle of the Golden Ford,"Legionaries captured a key river crossing after a coordinated flanking maneuver."
354,The Provincial Supply Census,"Administrators cataloged regional resources to improve wartime logistics."
355,Siege of Portus Vela,"Naval artillery bombarded harbor defenses before the final assault."
356,The Auxiliary Scout Wings,"Light cavalry units provided early reconnaissance for advancing legions."
357,The Frontier Peace Accord,"Diplomats negotiated temporary stability between rival tribal coalitions."
358,Fortress of Silver Ridge,"Strategically placed towers guarded access to mountain mining routes."
359,The Veteran Training Legions,"Experienced soldiers were assigned to newly formed regiments as instructors."
360,The Grain Reserve Mandate,"Emergency stockpiles were distributed among frontier garrisons."
361,War of the Emerald Banner,"Medieval factions fought for control of a wealthy coastal kingdom."
362,Siege of Westwatch Keep,"Defenders endured months of isolation before reinforcements arrived."
363,The Merchant Guard Compact,"Trading guilds hired professional soldiers to escort caravans."
364,Battle of Stonefield,"Heavy infantry clashes dominated the battlefield for an entire day."
365,The Royal Port Expansion,"Harbor improvements increased the kingdom’s naval capacity."
366,Order of the Iron Griffin,"A knightly brotherhood specialized in defending royal fortresses."
367,Fortress Dawncrest,"Hilltop battlements provided early detection of approaching armies."
368,The Border Toll Conflict,"Neighboring lords clashed over lucrative trade checkpoint revenues."
369,The Crown Coinage Reform,"Uniform currency standards improved commerce across feudal territories."
370,The Banner Summit Treaty,"Regional rulers negotiated a temporary alliance against external threats."
371,Battle of Frostplain,"Winter conditions forced armies into slow, grinding engagements."
372,The Abbey Refuge Charter,"Religious sanctuaries offered protection to displaced villagers."
373,The Timber Fleet Initiative,"Shipbuilding programs expanded naval patrol capabilities."
374,The Knightly Service Registry,"Feudal obligations were formally recorded to ensure mobilization readiness."
375,The Harvest Truce of Larkspur,"Opposing forces agreed to suspend hostilities during critical farming months."
376,Operation Iron Lifeline,"WW2 convoys maintained essential supply routes under heavy enemy pressure."
377,The Strategic Radar Chain,"Linked detection stations improved early warning against air raids."
378,Battle of Central Ridge,"Control of elevated terrain determined regional battlefield dominance."
379,The Emergency Vehicle Rationing Act,"Fuel allocations prioritized military transport units."
380,Operation Silent Crossing,"Paratroopers secured bridges ahead of a major ground advance."
381,The Arctic Escort Missions,"Naval patrols protected shipments traveling through northern waters."
382,Defense of Harbor District Five,"Anti-aircraft batteries shielded critical warehouse zones."
383,Operation Rolling Repair,"Engineering teams restored damaged roads during active campaigns."
384,The Allied Strategy Council,"Joint planning sessions coordinated simultaneous multinational offensives."
385,Battle of Iron Valley Pass,"Armored divisions clashed in a narrow mountain corridor."
386,The Mobile Field Workshops,"Forward repair units quickly returned damaged vehicles to service."
387,Operation Coastal Thunder,"Combined naval bombardment and landing forces captured key beaches."
388,The Industrial Resource Allocation Board,"Central authorities directed materials toward priority weapons production."
389,Battle of East Rail Terminal,"Urban fighting centered on control of a massive logistics hub."
390,The Convoy Air Patrol Expansion,"Long-range aircraft extended protection over shipping lanes."
391,Operation Northern Breakthrough,"Winter offensives shattered entrenched defensive positions."
392,The Communications Relay Corps,"Dedicated signal units ensured uninterrupted command coordination."
393,Battle of Harbor Heights Sector,"Troops fought for control of overlooking artillery positions."
394,The Emergency Medical Airlift,"Aircraft evacuated wounded soldiers from frontline zones."
395,Operation Granite Shield,"Extensive defensive fortifications delayed advancing enemy forces."
396,The Mountain Logistics Battalion,"Specialized transport units maintained supply lines through rugged terrain."
397,Operation Harbor Restoration,"Rapid reconstruction returned bomb-damaged ports to operation."
398,The Reconstruction Finance Commission,"Governments organized funding to rebuild infrastructure after the war."
399,The Veterans Industrial Employment Act,"Returning soldiers were integrated into national manufacturing sectors."
400,The International Security Compact,"Postwar agreements established long-term cooperative defense planning."
401,Legion of the Northern Shield,"Roman forces established fortified winter camps to maintain year-round border defense."
402,The Imperial Arsenal Expansion,"New weapon foundries increased the production of standardized military equipment."
403,Battle of Redwater Crossing,"A surprise dawn assault secured the vital bridge for advancing legions."
404,The Provincial Harbor Guard,"Special naval detachments protected trade ports from sudden raids."
405,Siege of Castellum Prime,"A prolonged encirclement forced the garrison to surrender after supplies dwindled."
406,The Auxiliary Rider Cohorts,"Mounted units from allied tribes provided rapid reconnaissance capabilities."
407,The Frontier Tribute Accord,"Negotiated payments ensured temporary peace with neighboring clans."
408,Fortress of Twin Bastions,"Massive double-layered walls made the stronghold nearly impregnable."
409,The Veteran Command Schools,"Experienced officers trained future battlefield commanders."
410,The Grain Route Patrol,"Regular escorts reduced bandit attacks on agricultural supply caravans."
411,War of the Sapphire Throne,"Medieval nobles fought over succession after the king died without heirs."
412,Siege of Ironwatch Tower,"Defenders used elevated artillery to repel repeated siege attempts."
413,The Merchant Guild Convoys,"Trade alliances organized heavily guarded caravans across contested lands."
414,Battle of Broadmoor,"Infantry lines engaged in a long stalemate before cavalry broke the deadlock."
415,The Royal Beacon Expansion,"Additional signal towers improved communication between frontier forts."
416,Order of the White Falcon,"Elite knights specialized in scouting and rapid response missions."
417,Fortress Stormgate,"Strategically positioned gates controlled access to a vital mountain valley."
418,The River Trade Dispute,"Competing kingdoms fought for control of profitable shipping lanes."
419,The Crown Revenue Reform,"Improved tax systems increased funding for military modernization."
420,The Banner Alliance of Westreach,"Several duchies formed a coalition to counter a powerful invader."
421,Battle of Frostwood,"Dense forests slowed maneuvering, leading to prolonged engagements."
422,The Abbey Relief Pact,"Religious institutions supplied food to towns affected by sieges."
423,The Timber Reserve Act,"Royal decrees protected forests needed for ship construction."
424,The Knightly Muster Festival,"Annual gatherings combined military inspection with ceremonial celebrations."
425,The Harvest Peace of Greenvale,"A temporary ceasefire allowed farmers to collect crops safely."
426,Operation Steel Harbor Shield,"WW2 naval defenses protected vital shipbuilding facilities."
427,The Allied Radar Calibration Program,"Technical upgrades improved aircraft detection accuracy."
428,Battle of Iron Plains,"Massed tank formations clashed across open countryside."
429,The Emergency Fuel Distribution Board,"Centralized planning ensured priority delivery to frontline units."
430,Operation Silent Ridge,"Commando teams captured observation posts overlooking invasion routes."
431,The Arctic Weather Recon Flights,"Aircraft gathered meteorological intelligence for naval operations."
432,Defense of Delta Rail Junction,"Fortified positions secured a key supply intersection."
433,Operation Rolling Convoy Guard,"Escort vehicles accompanied logistics columns through hostile zones."
434,The Joint Offensive Directive,"Allied commanders coordinated simultaneous advances on multiple fronts."
435,Battle of Harbor Gate,"Intense urban combat erupted around the main port entrance."
436,The Mobile Anti-Tank Units,"Rapid deployment teams countered advancing armored formations."
437,Operation Coastal Spear,"Amphibious forces landed at several points to divide enemy defenses."
438,The Industrial Workforce Mobilization,"Civilian labor programs expanded wartime production capacity."
439,Battle of Northern Escarpment,"High cliffs provided defenders with a significant tactical advantage."
440,The Communications Encryption Upgrade,"Improved coding systems reduced interception risks."
441,Operation Granite Thunder,"Heavy artillery barrages preceded a decisive infantry advance."
442,The Mountain Air Supply Command,"Transport planes sustained isolated units in rugged regions."
443,Battle of East Dockyards,"Naval clashes determined control of critical maintenance facilities."
444,The Emergency Field Hospital Initiative,"Rapid construction units established medical centers near frontlines."
445,Operation Iron Corridor Advance,"Armored columns secured a narrow passage connecting allied sectors."
446,The Reconstruction Rail Authority,"Postwar planners focused on restoring continental train networks."
447,The Veterans Land Grant Policy,"Returning soldiers received farmland to support rural recovery."
448,Operation Harbor Rebuild,"Engineering brigades restored damaged coastal infrastructure."
449,The Allied Economic Recovery Council,"Nations coordinated rebuilding efforts across liberated territories."
450,The Global Stability Charter,"International agreements established long-term frameworks for cooperative defense."
451,Legion of the Western Rampart,"Roman engineers constructed reinforced border walls to secure recently conquered lands."
452,The Imperial Supply Registry,"Central recordkeeping improved allocation of weapons and provisions to distant garrisons."
453,Battle of the Amber Crossing,"Legionary forces seized a strategic bridge after intense close-quarters combat."
454,The Harbor Defense Cohorts,"Special naval infantry units were assigned to protect major trading ports."
455,Siege of Fort Dalmora,"A lengthy blockade exhausted defenders before the final assault succeeded."
456,The Auxiliary Horse Archers,"Allied mounted archers provided flexible ranged support during open-field battles."
457,The Frontier Market Agreement,"Trade concessions reduced tensions between Rome and neighboring tribes."
458,Fortress of Iron Summit,"A mountaintop citadel served as the command hub for regional military operations."
459,The Veteran Reserve Command,"Retired soldiers were recalled during emergencies to reinforce depleted legions."
460,The Grain Caravan Escort,"Heavily guarded supply convoys ensured steady food delivery to frontier camps."
461,War of the Broken Crown,"Medieval factions competed for the throne after a disputed coronation."
462,Siege of Ravenshold,"Defenders relied on hidden tunnels to maintain supply lines during the encirclement."
463,The Merchant League Armada,"Coastal cities financed a defensive fleet to protect trade routes."
464,Battle of Stoneford,"A decisive cavalry maneuver shattered the opposing army’s defensive line."
465,The Royal Fortress Renovation,"Outdated castles were upgraded with improved defensive towers."
466,Order of the Golden Shield,"A knightly order dedicated itself to guarding royal treasuries."
467,Fortress Highwater,"Riverside fortifications prevented enemy crossings for decades."
468,The Border Tariff Conflict,"Rising customs duties triggered military confrontations between neighboring realms."
469,The Crown Coin Reform,"Uniform minting standards stabilized trade across the kingdom."
470,The Banner Pact of Eastvale,"Minor lords united temporarily to resist foreign expansion."
471,Battle of Winterfield,"Snow-covered terrain slowed both armies, resulting in a prolonged engagement."
472,The Abbey Relief Convoys,"Monastic networks transported food to famine-stricken towns."
473,The Timber Fleet Expansion,"Shipyards increased production to counter growing naval threats."
474,The Knightly Muster Rolls,"Detailed registries ensured accurate counts of feudal military obligations."
475,The Harvest Ceasefire of Alder Plains,"Seasonal agreements paused warfare to protect agricultural output."
476,Operation Iron Convoy Guard,"WW2 escort destroyers protected merchant shipping from submarine attacks."
477,The Strategic Radar Extension,"New installations filled coverage gaps along the coastline."
478,Battle of Central Valley Sector,"Armored divisions fought fiercely for control of open farmland."
479,The Emergency Fuel Storage Plan,"Hidden depots ensured operational readiness during supply disruptions."
480,Operation Silent Harbor Strike,"Commando teams sabotaged enemy dock facilities before invasion."
481,The Arctic Naval Patrols,"Ice-capable vessels escorted convoys through hazardous northern seas."
482,Defense of Junction Airbase,"Fighter squadrons defended a critical logistics airport."
483,Operation Rolling Bridge,"Portable bridge units enabled rapid troop crossings during offensives."
484,The Allied Strategic Planning Council,"Joint command meetings coordinated long-term military objectives."
485,Battle of Granite Pass,"Defenders used narrow terrain to offset the enemy’s numerical advantage."
486,The Mobile Repair Convoys,"Traveling workshops restored damaged vehicles directly behind the front."
487,Operation Coastal Breaker,"Combined naval and ground assaults captured heavily fortified beaches."
488,The Industrial Production Mandate,"Government directives required factories to meet strict wartime quotas."
489,Battle of East Harbor Channel,"Naval engagements determined control of shipping access routes."
490,The Convoy Air Escort Program,"Long-range fighters extended protection for distant maritime convoys."
491,Operation Northern Encirclement,"Rapid mechanized movements surrounded retreating enemy forces."
492,The Communications Signal Corps,"Dedicated radio teams maintained constant battlefield coordination."
493,Battle of Ridgepoint Heights,"Artillery positioned on high ground dominated the surrounding battlefield."
494,The Emergency Medical Transport Fleet,"Converted aircraft evacuated wounded soldiers quickly."
495,Operation Granite Line Defense,"A network of bunkers slowed the advance of attacking armies."
496,The Mountain Logistics Initiative,"Tracked transport vehicles supplied troops in difficult terrain."
497,Operation Harbor Recovery Teams,"Engineering units rapidly restored damaged dockyards to service."
498,The Reconstruction Trade Network,"Postwar agreements reopened vital international shipping lanes."
499,The Veterans Workforce Integration Act,"Returning soldiers were offered employment in national infrastructure projects."
500,The Continental Defense Partnership,"Allied nations formalized joint planning to maintain long-term regional stability."
